{
  "$schema": "../package.schema.json",
  "name": "pkg",
  "description": "A simple package manager for macOS",
  "homepage": "https://pkg.zerolimits.dev",
  "version": "0.1.8",
  "sha256": "2e16fa73e34f14daa930f7cb3149c609568c7e68d9ecf1134ee9ef691d072d7e",
  "url": "https://github.com/noClaps/pkg/releases/download/v{{ version }}/pkg.tar.xz",
  "scripts": {
    "install": [
      "tar -xf pkg.tar.xz",
      "install pkg {{ pkg.bin_dir }}/pkg"
    ],
    "latest": [
      "gh release list -R noClaps/pkg --json tagName --jq '.[0].tagName' | cut -c 2-"
    ],
    "completions": [
      "pkg --completions zsh > {{ pkg.completions.zsh }}/_pkg"
    ]
  }
}
